{
  "id": "80k-funding",
  "title": "It looks like there are some good funding opportunities in AI safety right now",
  "publisher": "80,000 Hours",
  "url": "https://80000hours.org/2025/01/it-looks-like-there-are-some-good-funding-opportunities-in-ai-safety-right-now/",
  "published": "2025-10-13",
  "retrieved": "2026-09-14",
  "note": "CAIS advises xAI, not receiving OP money; SFF grants; METR not receiving OP recently; SecureBio SFF grant."
}
