{
  "id": "crowell-sb315",
  "title": "Illinois AI Safety Measures Act SB 315",
  "publisher": "Crowell & Moring",
  "url": "https://www.crowell.com/en/insights/client-alerts/illinois-imposes-transparency-and-safety-obligations-on-frontier-ai-systems",
  "published": "2026-07-08",
  "retrieved": "2026-09-14",
  "note": "Annual independent audits from 2028; no financial interest either way; high-level summary published within 30 days."
}
