{
  "id": "tnw-hf-nvidia",
  "title": "Hugging Face's Open Alignment Initiative wants lab access",
  "publisher": "TNW",
  "url": "https://thenextweb.com/news/hugging-face-open-alignment-initiative-embedded-evaluators",
  "published": "2026-09-14",
  "retrieved": "2026-09-14",
  "note": "Nvidia acquiring Hugging Face ($12.93B); Nvidia in talks to anchor Anthropic IPO (up to $10B); no terms announced."
}
